{
  "schemaVersion": 1,
  "datasetRevision": "m1-fixtures-2026-07-28.1",
  "policyRevision": "m1-policy-c4e3e4a.1",
  "toolSnapshotRevision": "m1-tools-c4e3e4a.1",
  "scenarios": [
    {"id":"computer.observe.targets-bounded","app":"Computer","channel":"cua","actionFamily":"observe.targets","executionPath":"computer","risk":"read","boundaryRef":"tests/computer.test.ts#requires-a-fresh-observation","expectedOutcome":"success","tags":["fixture","bounded"]},
    {"id":"computer.observe.window-allowlisted","app":"Computer","channel":"cua","actionFamily":"observe.window","executionPath":"computer","risk":"read","boundaryRef":"tests/computer.test.ts#application-allowlist","expectedOutcome":"success","tags":["fixture","allowlist"]},
    {"id":"computer.observe.window-denied-app","app":"Computer","channel":"cua","actionFamily":"observe.window","executionPath":"computer","risk":"read","boundaryRef":"tests/computer.test.ts#connector-owned-app","expectedOutcome":"blocked","tags":["fixture","route-owner"]},
    {"id":"computer.observe.window-control-plane","app":"Computer","channel":"cua","actionFamily":"observe.window","executionPath":"computer","risk":"read","boundaryRef":"tests/computer.test.ts#protected-control-plane","expectedOutcome":"blocked","tags":["fixture","control-plane"]},
    {"id":"computer.observe.region-bounds","app":"Computer","channel":"cua","actionFamily":"observe.region","executionPath":"computer","risk":"read","boundaryRef":"tests/computer.test.ts#region-bounds","expectedOutcome":"success","tags":["fixture","bounds"]},
    {"id":"computer.observe.screenshot-capability","app":"Computer","channel":"cua","actionFamily":"observe.screenshot","executionPath":"computer","risk":"read","boundaryRef":"tests/computer.test.ts#image-capability","expectedOutcome":"blocked","tags":["fixture","capability"]},
    {"id":"computer.observe.driver-no-prompt","app":"Computer","channel":"cua","actionFamily":"readiness","executionPath":"computer","risk":"read","boundaryRef":"tests/computer.test.ts#driver-readiness","expectedOutcome":"success","tags":["fixture","no-tcc"]},
    {"id":"computer.act.stale-observation","app":"Computer","channel":"cua","actionFamily":"act.guard","executionPath":"computer","risk":"low_write","boundaryRef":"tests/computer.test.ts#fresh-observation","expectedOutcome":"blocked","tags":["fixture","stale"]},
    {"id":"computer.act.wrong-run-observation","app":"Computer","channel":"cua","actionFamily":"act.guard","executionPath":"computer","risk":"low_write","boundaryRef":"tests/computer.test.ts#run-ownership","expectedOutcome":"blocked","tags":["fixture","ownership"]},
    {"id":"computer.act.background-required","app":"Computer","channel":"cua","actionFamily":"act.background","executionPath":"computer","risk":"low_write","boundaryRef":"tests/computer.test.ts#access-boundary","expectedOutcome":"blocked","tags":["fixture","authorization"]},
    {"id":"computer.act.background-unsupported","app":"Computer","channel":"cua","actionFamily":"act.background","executionPath":"computer","risk":"low_write","boundaryRef":"tests/computer.test.ts#background-unsupported","expectedOutcome":"partial","tags":["fixture","background"]},
    {"id":"computer.act.foreground-delivery-rejected","app":"Computer","channel":"cua","actionFamily":"act.background","executionPath":"computer","risk":"low_write","boundaryRef":"tests/computer.test.ts#foreground-delivery","expectedOutcome":"failed","tags":["fixture","user-activity"]},
    {"id":"computer.act.secure-field","app":"Computer","channel":"cua","actionFamily":"act.input","executionPath":"computer","risk":"high_write","boundaryRef":"tests/computer.test.ts#secure-field","expectedOutcome":"blocked","tags":["fixture","secure"]},
    {"id":"computer.act.coordinate-bounds","app":"Computer","channel":"cua","actionFamily":"act.pointer","executionPath":"computer","risk":"low_write","boundaryRef":"tests/computer.test.ts#coordinate-bounds","expectedOutcome":"blocked","tags":["fixture","bounds"]},
    {"id":"computer.act.result-uncertain","app":"Computer","channel":"cua","actionFamily":"act.receipt","executionPath":"computer","risk":"low_write","boundaryRef":"tests/computer.test.ts#uncertain","expectedOutcome":"uncertain","tags":["fixture","no-retry"]},
    {"id":"computer.act.applied-not-confirmed","app":"Computer","channel":"cua","actionFamily":"act.receipt","executionPath":"computer","risk":"low_write","boundaryRef":"tests/computer.test.ts#verified-false","expectedOutcome":"partial","tags":["fixture","receipt"]},
    {"id":"computer.act.foreground-lease-restore","app":"Computer","channel":"cua","actionFamily":"user-activity","executionPath":"computer","risk":"low_write","boundaryRef":"tests/computer.test.ts#foreground-lease","expectedOutcome":"success","tags":["fixture","restore"]},
    {"id":"computer.act.handoff-retained","app":"Computer","channel":"cua","actionFamily":"user-activity","executionPath":"computer","risk":"low_write","boundaryRef":"tests/computer.test.ts#handoff","expectedOutcome":"success","tags":["fixture","handoff"]},
    {"id":"computer.act.admin-gated","app":"Computer","channel":"cua","actionFamily":"kill-switch","executionPath":"computer","risk":"high_write","boundaryRef":"tests/computer.test.ts#admin-driver","expectedOutcome":"blocked","tags":["fixture","kill-switch"]},
    {"id":"computer.act.text-redacted","app":"Computer","channel":"cua","actionFamily":"evidence","executionPath":"computer","risk":"low_write","boundaryRef":"tests/computer.test.ts#type-text-redaction","expectedOutcome":"success","tags":["fixture","redaction"]},
    {"id":"browser.tabs.list-bounded","app":"Browser","channel":"macos-browser","actionFamily":"tabs.read","executionPath":"connector","risk":"read","boundaryRef":"tests/macos-browser-connector.test.ts#list-tabs","expectedOutcome":"success","tags":["fixture","bounded"]},
    {"id":"browser.tabs.active-read","app":"Browser","channel":"macos-browser","actionFamily":"tabs.read","executionPath":"connector","risk":"read","boundaryRef":"tests/macos-browser-connector.test.ts#active-tab","expectedOutcome":"success","tags":["fixture","background"]},
    {"id":"browser.page.text-bounded","app":"Browser","channel":"macos-browser","actionFamily":"page.read","executionPath":"connector","risk":"read","boundaryRef":"tests/macos-browser-connector.test.ts#page-text","expectedOutcome":"success","tags":["fixture","bounded"]},
    {"id":"browser.page.text-untrusted","app":"Browser","channel":"macos-browser","actionFamily":"page.read","executionPath":"connector","risk":"read","boundaryRef":"tests/macos-browser-connector.test.ts#untrusted","expectedOutcome":"success","tags":["fixture","provenance"]},
    {"id":"browser.navigate.invalid-scheme","app":"Browser","channel":"macos-browser","actionFamily":"navigation.write","executionPath":"connector","risk":"low_write","boundaryRef":"tests/macos-browser-connector.test.ts#http-only","expectedOutcome":"blocked","tags":["fixture","validation"]},
    {"id":"browser.navigate.invalid-ref","app":"Browser","channel":"macos-browser","actionFamily":"navigation.write","executionPath":"connector","risk":"low_write","boundaryRef":"tests/macos-browser-connector.test.ts#tab-ref","expectedOutcome":"blocked","tags":["fixture","stable-target"]},
    {"id":"browser.execute.script-bounded","app":"Browser","channel":"macos-browser","actionFamily":"page.execute","executionPath":"connector","risk":"low_write","boundaryRef":"tests/macos-browser-connector.test.ts#script-limit","expectedOutcome":"blocked","tags":["fixture","bounds"]},
    {"id":"browser.action.timeout","app":"Browser","channel":"macos-browser","actionFamily":"readiness","executionPath":"connector","risk":"low_write","boundaryRef":"tests/macos-browser-connector.test.ts#timeout","expectedOutcome":"failed","tags":["fixture","kill-switch"]},
    {"id":"browser.action.invalid-json","app":"Browser","channel":"macos-browser","actionFamily":"readiness","executionPath":"connector","risk":"low_write","boundaryRef":"tests/macos-browser-connector.test.ts#invalid-json","expectedOutcome":"failed","tags":["fixture","corrupt"]},
    {"id":"browser.action.output-overflow","app":"Browser","channel":"macos-browser","actionFamily":"readiness","executionPath":"connector","risk":"read","boundaryRef":"tests/macos-browser-connector.test.ts#overflow","expectedOutcome":"failed","tags":["fixture","bounds"]},
    {"id":"screen.read.temporary-cleanup","app":"Screen","channel":"macos-screen","actionFamily":"screen.read","executionPath":"connector","risk":"read","boundaryRef":"tests/macos-screen-connector.test.ts#temporary-cleanup","expectedOutcome":"success","tags":["fixture","cleanup"]},
    {"id":"screen.read.rect-bounds","app":"Screen","channel":"macos-screen","actionFamily":"screen.read","executionPath":"connector","risk":"read","boundaryRef":"tests/macos-screen-connector.test.ts#rect-target","expectedOutcome":"success","tags":["fixture","bounds"]},
    {"id":"screen.capture.argv-only","app":"Screen","channel":"macos-screen","actionFamily":"screen.capture","executionPath":"connector","risk":"read","boundaryRef":"tests/macos-screen-connector.test.ts#argv-only","expectedOutcome":"success","tags":["fixture","injection"]},
    {"id":"screen.capture.extension-rejected","app":"Screen","channel":"macos-screen","actionFamily":"screen.capture","executionPath":"connector","risk":"read","boundaryRef":"tests/macos-screen-connector.test.ts#png-only","expectedOutcome":"blocked","tags":["fixture","validation"]},
    {"id":"screen.ocr.absolute-path","app":"Screen","channel":"macos-screen","actionFamily":"ocr.read","executionPath":"connector","risk":"read","boundaryRef":"tests/macos-screen-connector.test.ts#absolute-path","expectedOutcome":"blocked","tags":["fixture","validation"]},